{
  "schema_version": "flash-liquidity-teaching-example-v0.1",
  "route_candidate_id": "triangle:teaching-example",
  "providers": [
    {
      "provider_id": "flash-provider:teaching-a",
      "fee_bps": 9.0,
      "capacity_by_asset": {"USD": 5000.0},
      "authority": false
    },
    {
      "provider_id": "flash-provider:teaching-b",
      "fee_bps": 30.0,
      "capacity_by_asset": {"USD": 20000.0},
      "authority": false
    }
  ],
  "amount_buckets": [
    {
      "bucket_id": "flash-bucket:usd-1000",
      "asset": "USD",
      "principal_amount": 1000.0,
      "authority": false
    },
    {
      "bucket_id": "flash-bucket:usd-10000",
      "asset": "USD",
      "principal_amount": 10000.0,
      "authority": false
    }
  ],
  "note": "Teaching fixture only. Declared capacities and fees are not live market data.",
  "authority": false
}
